Usuario,Nombre,Fecha,Texto,Likes,Retweets,Comentarios,Citas,Enlace,Imágenes,Videos,GIFs,Tipo
@AtentosMTYSur,Atentos Mty Sur ¡vecinos en acción!,"Jun 6, 2024 · 6:57 PM UTC",reportan accidente en garza sada de nte a sur carril central dos vehículos a la altura de burger king poco después del pasó a desnivel de luis elizondo precaución al circular por la zona sspcmonterrey,8,4,0,0,https://twitter.com/AtentosMTYSur/status/1798791403356778687#m,"['https://pbs.twimg.com/media/GPaXP3mWUAAbh3v.jpg', 'https://pbs.twimg.com/media/GPaXP50aEAAZrXc.jpg']",,,no se relaciona
@AtentosMTYSur,Atentos Mty Sur ¡vecinos en acción!,"Jun 5, 2024 · 9:34 PM UTC",reportan trafico lento en garza sada de nte a sur por accidente en carril central poco antes de walmart las torres precaución al circular por la zona sspcmonterrey,6,1,0,0,https://twitter.com/AtentosMTYSur/status/1798468551445242165#m,"['https://pbs.twimg.com/media/GPVxncXbwAEEgqS.jpg', 'https://pbs.twimg.com/media/GPVxneMaUAATCI7.jpg']",,,no se relaciona
@AtentosMTYSur,Atentos Mty Sur ¡vecinos en acción!,"Jun 5, 2024 · 8:30 PM UTC",reportan un accidente en garza sada y alfonso reyes sobre la lateral frente a la plaza contry precaución al circular por la zona sspcmonterrey,14,2,0,0,https://twitter.com/AtentosMTYSur/status/1798452339495637449#m,"['https://pbs.twimg.com/media/GPVi3vnaIAAI5rP.jpg', 'https://pbs.twimg.com/media/GPVi30ZaMAA4JbF.jpg']",,,no se relaciona
@AtentosMTYSur,Atentos Mty Sur ¡vecinos en acción!,"Jun 1, 2024 · 5:57 PM UTC",accidente por alcance en garza sada de sur a norte a la altura de pletorico en carril de alta precaución al circular por la zona sspcmonterrey,9,3,1,0,https://twitter.com/AtentosMTYSur/status/1796964321546686614#m,"['https://pbs.twimg.com/media/GPAZhpcbAAA_rU2.jpg', 'https://pbs.twimg.com/media/GPAZhuraUAAMXCF.jpg']",,,no se relaciona
@AtentosMTYSur,Atentos Mty Sur ¡vecinos en acción!,"May 28, 2024 · 10:32 PM UTC",reportan un accidente en garza sada de sur a norte a la altura de fuerza civil dos carriles comprometidos precaución al circular por la zona sspcmonterrey,20,3,9,2,https://twitter.com/AtentosMTYSur/status/1795583967124705732#m,"['https://pbs.twimg.com/media/GOsyGe8bcAM_K-j.jpg', 'https://pbs.twimg.com/media/GOsyGe4bcAkw02Y.jpg', 'https://pbs.twimg.com/media/GOsyGlJbcAYt_3t.jpg']",,,no se relaciona
@AtentosMTYSur,Atentos Mty Sur ¡vecinos en acción!,"May 25, 2024 · 10:23 PM UTC",reportan accidente fuerte en carretera nacional de nte a sur a la altura de la plaza omnia dos carriles comprometidos precaución al circular por la zona permita el paso a las unidades de auxilio pcnuevoleon gncarreteras cnacgn,41,7,2,1,https://twitter.com/AtentosMTYSur/status/1794494406273212564#m,,['https://video.twimg.com/ext_tw_video/1794494395917729793/pu/pl/q9JW8cYfX8dtyyd0.m3u8?tag=12'],,no se relaciona
@AtentosMTYSur,Atentos Mty Sur ¡vecinos en acción!,"May 25, 2024 · 2:58 AM UTC",reportan trafico lento por accidente grave en lázaro cardenas al oriente a la altura de la ladrillera al parecer se trata de un motociclista precaución al circular por la zona sspcmonterrey,8,1,1,0,https://twitter.com/AtentosMTYSur/status/1794201451373404315#m,"['https://pbs.twimg.com/media/GOZItkHW8AAGHbp.jpg', 'https://pbs.twimg.com/media/GOZItkwXYAAV_kM.jpg', 'https://pbs.twimg.com/media/GOZItllWQAAi34o.jpg']",,,no se relaciona
@AtentosMTYSur,Atentos Mty Sur ¡vecinos en acción!,"May 24, 2024 · 11:00 PM UTC",reportan un accidente en alfonso reyes a la altura de avenida las musas en contry tesoro en dirección de revolución a garza sada frente al seven precaución al circular por la zona sspcmonterrey,6,1,1,0,https://twitter.com/AtentosMTYSur/status/1794141500428759160#m,['https://pbs.twimg.com/media/GOYSL93aEAAGW-0.jpg'],,,no se relaciona
@AtentosMTYSur,Atentos Mty Sur ¡vecinos en acción!,"May 24, 2024 · 10:10 PM UTC",reportan incendio de pastizal en garza sada de sur a norte poco antes del motel en el cruce de estanzuela y valle alto precaución al circular por la zona permita el paso a las unidades de emergencia bomberosnl pcmty pcnuevoleon,6,2,0,0,https://twitter.com/AtentosMTYSur/status/1794128747735445730#m,"['https://pbs.twimg.com/media/GOYGllAacAA1FqG.jpg', 'https://pbs.twimg.com/media/GOYGlqmbMAA3NDL.jpg']",,,eléctrico
@AtentosMTYSur,Atentos Mty Sur ¡vecinos en acción!,"May 24, 2024 · 6:34 PM UTC",reportan incendio en revolución y alfonso reyes sobre el río la silla precaución al circular por la zona permita el paso a los servicios de emergencia pcnuevoleon pcmty bomberosnl,49,12,2,1,https://twitter.com/AtentosMTYSur/status/1794074578584519041#m,,['https://video.twimg.com/ext_tw_video/1794074554211659776/pu/pl/3HqdlSmZoYKfAWiA.m3u8?tag=12'],,eléctrico
@AtentosMTYSur,Atentos Mty Sur ¡vecinos en acción!,"May 21, 2024 · 8:52 PM UTC",reportan accidente en avenida estanzuela poco después de soriana sspcmonterrey,1,0,0,0,https://twitter.com/AtentosMTYSur/status/1793022020373934370#m,"['https://pbs.twimg.com/media/GOIYBi_WsAAOjUM.jpg', 'https://pbs.twimg.com/media/GOIYBknWIAAUE6b.jpg']",,,no se relaciona
@AtentosMTYSur,Atentos Mty Sur ¡vecinos en acción!,"May 21, 2024 · 12:08 AM UTC",accidente en carretera nacional a la altura del faisan frente a la iglesia san gerardo el camion de carga con las varillas se queda sin la llanta trasera solo un carril disponible en dirección a santiago precaución al circular por la zona gncarreteras cnacgn,6,0,1,0,https://twitter.com/AtentosMTYSur/status/1792708940486304026#m,['https://pbs.twimg.com/media/GOD7R7xW8AAQRmR.jpg'],,,no se relaciona
@AtentosMTYSur,Atentos Mty Sur ¡vecinos en acción!,"May 20, 2024 · 8:24 PM UTC",accidente por alcance en cañón del huajuco y antiguo camino a villa de santiago en la zona de la estanzuela de ser posible evite la zona precaución al circular por la zona sspcmonterrey,2,0,0,0,https://twitter.com/AtentosMTYSur/status/1792652747034001588#m,"['https://pbs.twimg.com/media/GODILE0XsAAQ83l.jpg', 'https://pbs.twimg.com/media/GODILDkWMAArpup.jpg']",,,no se relaciona
@AtentosMTYSur,Atentos Mty Sur ¡vecinos en acción!,"May 15, 2024 · 8:08 PM UTC",reportan accidente en garza sada de sur a norte frente a pletorico reportan dos carriles comprometidos precaución al circular por la zona sspcmonterrey,15,4,6,0,https://twitter.com/AtentosMTYSur/status/1790836689688055887#m,"['https://pbs.twimg.com/media/GNpUenlWoAEC484.jpg', 'https://pbs.twimg.com/media/GNpUen2W0AA6qhJ.jpg', 'https://pbs.twimg.com/media/GNpUepuWoAAQtq6.jpg']",,,no se relaciona
@yadithvaldez,Yadith Valdez,"May 13, 2024 · 10:46 PM UTC",mientras en nuevoleón se registran de a grados centígrados de temperatura en laredo texas y nuevolaredotamaulipas se reportan intensas lluvias y granizada en anáhuac nuevo león reportan caída de granizo de gran tamaño,424,86,8,1,https://twitter.com/yadithvaldez/status/1790151708280054184#m,"['https://pbs.twimg.com/media/GNflfXaWMAA-trv.jpg', 'https://pbs.twimg.com/media/GNflfXMXUAA2KLl.jpg', 'https://pbs.twimg.com/media/GNflfXPX0AA9_ve.jpg']",,,lluvia
@AtentosMTYSur,Atentos Mty Sur ¡vecinos en acción!,"May 8, 2024 · 9:31 PM UTC",reportan un accidente en garza sada de sur a norte frente a parque canoas precaución al circular por la zona sspcmonterrey,10,1,1,0,https://twitter.com/AtentosMTYSur/status/1788320915450696039#m,"['https://pbs.twimg.com/media/GNFkZSmW8AALg_V.jpg', 'https://pbs.twimg.com/media/GNFkZU-W8AEaEzF.jpg']",,,no se relaciona
@AtentosMTYSur,Atentos Mty Sur ¡vecinos en acción!,"May 8, 2024 · 8:56 PM UTC",reportan accidente en garza sada de sur a norte frente a pletorico carril de alta precaución al circular por la zona sspcmonterrey,9,3,2,0,https://twitter.com/AtentosMTYSur/status/1788311978588393529#m,['https://pbs.twimg.com/media/GNFcRH4WgAA2hLk.jpg'],,,no se relaciona
@AtentosMTYSur,Atentos Mty Sur ¡vecinos en acción!,"May 8, 2024 · 4:48 PM UTC",reportan un accidente grave en carretera nacional a la altura del yerbaniz de sur a norte permita el paso a las unidades de auxilio precaución al circular por la zona gncarreteras cnacgn pcnuevoleon,61,20,1,0,https://twitter.com/AtentosMTYSur/status/1788249643601535175#m,,['https://video.twimg.com/ext_tw_video/1788249631014436864/pu/pl/p_6z1H1B3Pscs8h9.m3u8?tag=12'],,no se relaciona
@AtentosMTYSur,Atentos Mty Sur ¡vecinos en acción!,"May 7, 2024 · 9:04 PM UTC",reportan accidente menor en garza sada de sur a norte en carril de baja poco antes de la intersección al cruce de heb y soriana estanzuela precaución al circular por la zona sspcmonterrey,3,0,0,0,https://twitter.com/AtentosMTYSur/status/1787951663422022088#m,"['https://pbs.twimg.com/media/GNAUj9eXoAAsCfN.jpg', 'https://pbs.twimg.com/media/GNAUj-tXwAAp4Xl.jpg']",,,no se relaciona
@AtentosMTYSur,Atentos Mty Sur ¡vecinos en acción!,"May 6, 2024 · 10:30 PM UTC",reportan un accidente con un motociclista en garza sada de sur a norte en carril de alta a la altura de autozone poco antes de lagos del bosque precaución al circular por la zona sspcmonterrey,9,0,0,0,https://twitter.com/AtentosMTYSur/status/1787610902620946566#m,,['https://video.twimg.com/ext_tw_video/1787610879829176320/pu/pl/-EeqfitaQYTcAApT.m3u8?tag=12'],,no se relaciona
@AtentosMTYSur,Atentos Mty Sur ¡vecinos en acción!,"May 3, 2024 · 8:50 PM UTC",reportan un accidente en antiguo camino a villa de santiago y carteros colonia granja postal de sur a norte precaución al circular por la zona sspcmonterrey,4,2,0,0,https://twitter.com/AtentosMTYSur/status/1786498567810564242#m,"['https://pbs.twimg.com/media/GMrq-t4WIAE5Vhm.jpg', 'https://pbs.twimg.com/media/GMrq-vXWUAAdEjv.jpg']",,,no se relaciona
@Apodaca_News,APODACA NEWS,"Jun 21, 2024 · 5:09 AM UTC",don antonio olalde bustamante de años fue visto en la lluvia desorientado y no recuerda donde vive está en resguardo en la delegación margaritas apodaca sspapodaca,28,23,1,0,https://twitter.com/Apodaca_News/status/1804018831687356876#m,['https://pbs.twimg.com/media/GQkpkQXXMAArWLw.jpg'],,,lluvia
@Apodaca_News,APODACA NEWS,"Jun 20, 2024 · 11:03 PM UTC",ultimahora el gobierno de nuevoleon autoriza reanudar las actividades laborales y de transporte con normalidad mañana viernes de junio se reanudan labores despues del paso de la tormenta alberto que trajo fuertes lluvias a la ciudad de regreso a la normalidad,112,7,2,0,https://twitter.com/Apodaca_News/status/1803926686423011817#m,['https://pbs.twimg.com/media/GQjVZeTXEAACJ9K.jpg'],,,lluvia
@Apodaca_News,APODACA NEWS,"Jun 21, 2024 · 3:24 AM UTC",ante las inundaciones en la ciudad el transmetro se suspende en sectores de apodaca,7,1,0,0,https://twitter.com/Apodaca_News/status/1803992484285919520#m,,,,inundación
@horaceroweb,Hora Cero Web,"Jun 21, 2024 · 12:33 AM UTC",peligro trabajador se expone pasando sobre los pedazos que estaban a punto de caer del carril express en el río santa catarina de monterrey lluvias alberto,1024,178,70,14,https://twitter.com/horaceroweb/status/1803949433908007134#m,,['https://video.twimg.com/ext_tw_video/1803949178252595201/pu/pl/kVj23Eqmm7NXYpRa.m3u8?tag=12'],,lluvia
@Apodaca_News,APODACA NEWS,"Jun 21, 2024 · 2:04 AM UTC",vista desde quinta colonial apodaca viendo a la tormenta alejándose de la ciudad dejando más lluvia a su paso extremen precauciones,74,4,3,0,https://twitter.com/Apodaca_News/status/1803972140028342734#m,,['https://video.twimg.com/amplify_video/1803972090908803072/pl/FgBRZBU3hMLUe8V6.m3u8?tag=16'],,lluvia
@Apodaca_News,APODACA NEWS,"Jun 20, 2024 · 8:26 PM UTC",si bien los números empiezan a subir poco a poco esta lluvia es un respiro para nuestras presas cerro prieto estaba a punto de secarse la boca años sin llegar al y el cuchillo era muy bajo el nivel aun faltan unos dias de lluvia y los escurrimientos buenas noticias,45,4,4,0,https://twitter.com/Apodaca_News/status/1803887091392122937#m,['https://pbs.twimg.com/media/GQixbc3WYAEVgrp.png'],,,lluvia
@elnortelocal,elnortelocal,"Jun 20, 2024 · 7:05 PM UTC",local ayd pide a la población no beber agua de la llave ya que por las recientes lluvias los procesos de purificación no alcanzan a aclararla,843,213,55,21,https://twitter.com/elnortelocal/status/1803866682655424820#m,,['https://video.twimg.com/ext_tw_video/1803866604289056769/pu/pl/AK4Kkhb2EQ-3jJut.m3u8?tag=12'],,lluvia
@Apodaca_News,APODACA NEWS,"Jun 20, 2024 · 6:33 PM UTC",la tormenta tropical alberto ahora es una depresión tropical no parará la lluvia se vienen las horas con mas cantidad de agua precaucion,197,25,1,4,https://twitter.com/Apodaca_News/status/1803858760621830376#m,['https://pbs.twimg.com/media/GQiX0dlXQAAmjNX.png'],,,lluvia
@samuel_garcias,Samuel García,"Jun 20, 2024 · 4:40 PM UTC",todos en alerta y en resguardo ni labores ni clases viene lluvia extrema,5037,421,194,47,https://twitter.com/samuel_garcias/status/1803830274599366965#m,['https://pbs.twimg.com/media/GQh-ExwWsAAGboG.jpg'],,,lluvia
@jaimeromanjr,Jaime Sanchez,"Jun 20, 2024 · 4:13 PM UTC",buenos días pasé por concordia entre av e sexta hasta antiguo camino santa rosa y todo está bien no hay inundación,12,1,0,0,https://twitter.com/jaimeromanjr/status/1803823521958887433#m,,,,inundación
@Apodaca_News,APODACA NEWS,"Jun 20, 2024 · 3:44 PM UTC",encomiéndense a san transformador para que no se les vaya la luz con esta tormenta querido transformador no me vayas a fallar no sea que durante la lluvia te me vayas a estallar aguanta los fuertes vientos también esos chubascones porque ocupamos la luz pa aguantar,24,7,1,0,https://twitter.com/Apodaca_News/status/1803816076922208556#m,['https://pbs.twimg.com/media/GQhxKViW8AAqYWL.png'],,,inundación
@Apodaca_News,APODACA NEWS,"Jun 20, 2024 · 3:43 PM UTC",regresa la lluvia en la zona santa rosa apodaca,44,1,3,0,https://twitter.com/Apodaca_News/status/1803815950925340785#m,,,,lluvia
@Apodaca_News,APODACA NEWS,"Jun 20, 2024 · 3:13 PM UTC",esto aun no acaba a medio día podríamos recibir más lluvias por el paso de alberto sobre nuevoleon no se confíen atentos a los pronósticos,24,2,0,0,https://twitter.com/Apodaca_News/status/1803808361143587215#m,,,,lluvia
@Conagua_OCRB,Conagua OCRB Mty,"Jun 20, 2024 · 2:29 PM UTC",corte de lluvias de las hrs del día miércoles de junio a las hrs del jueves de junio registradas en las estaciones automáticas del ocrb,217,55,4,4,https://twitter.com/Conagua_OCRB/status/1803797371366621418#m,['https://pbs.twimg.com/media/GQhgJZVWMAA7qbG.jpg'],,,lluvia
@GobSanNicolas,Gobierno de San Nicolás,"Jun 21, 2024 · 5:09 AM UTC",av universidad tapia a la altura de estación del metro tapia inundación media arroyo la talaverana a la altura de la col blas chumacera y talaverana inundación media,1,2,1,0,https://twitter.com/GobSanNicolas/status/1804018851178307869#m,,,,inundación
@mtygob,Gobierno Monterrey,"Jun 21, 2024 · 2:51 AM UTC",cierres a la vialidad por inundaciones hasta el momento zona sur camino al mirador y lazaro cardenas parque canoas antiguo camino a villa de santiago y avenida la hacienda antiguo camino a villa de santiago y santa anita,70,15,1,0,https://twitter.com/mtygob/status/1803983994243158135#m,,,,inundación
@AeropuertoDeMTY,Aeropuerto Internacional de Monterrey,"Jun 21, 2024 · 4:48 AM UTC",aeropuertodemty informa c de temperatura de humedad millas de visibilidad cielo cubierto a una altura de ft y lluvia ligera aeropuerto operando,18,2,2,1,https://twitter.com/AeropuertoDeMTY/status/1804013551561961564#m,,,,lluvia
@GobSanNicolas,Gobierno de San Nicolás,"Jun 21, 2024 · 4:37 AM UTC",intensidad de lluvia por región zona poniente moderadaconstante zona centro moderadaconstante zona oriente moderadaconstante,1,1,0,0,https://twitter.com/GobSanNicolas/status/1804010799746187438#m,,,,lluvia
@GobSanNicolas,Gobierno de San Nicolás,"Jun 21, 2024 · 4:39 AM UTC",cruces en zonas de riesgo juan pablo ii cristina larralde inundación media las puentes cristina larralde inundación media,2,1,0,0,https://twitter.com/GobSanNicolas/status/1804011246468870161#m,,,,inundación
@GobSanNicolas,Gobierno de San Nicolás,"Jun 21, 2024 · 4:40 AM UTC",av universidad tapia a la altura de estación del metro tapia inundación media arroyo la talaverana a la altura de la col blas chumacera y talaverana inundación media,0,1,1,0,https://twitter.com/GobSanNicolas/status/1804011397203866010#m,,,,inundación
@GobSanNicolas,Gobierno de San Nicolás,"Jun 21, 2024 · 4:11 AM UTC",intensidad de lluvia por región zona poniente moderadaconstante zona centro moderadaconstante zona oriente moderadaconstante,0,1,0,0,https://twitter.com/GobSanNicolas/status/1804004230434304190#m,,,,lluvia
@IMSSNL,IMSS Nuevo León,"Jun 21, 2024 · 3:40 AM UTC",mensaje importante del titular del imssnl dr tonatihu ortiz castillo sobre las afectaciones de las fuertes lluvias en la umf no,21,6,1,0,https://twitter.com/IMSSNL/status/1803996300544741541#m,,['https://video.twimg.com/ext_tw_video/1803996179283181569/pu/pl/kt3MVMPF_uEIN9F8.m3u8?tag=12'],,lluvia
@GobSanNicolas,Gobierno de San Nicolás,"Jun 21, 2024 · 2:36 AM UTC",intensidad de lluvia por región zona poniente intensaconstante zona centro intensaconstante zona oriente intensaconstante,2,2,1,0,https://twitter.com/GobSanNicolas/status/1803980396956094727#m,,,,lluvia
@GobSanNicolas,Gobierno de San Nicolás,"Jun 21, 2024 · 2:37 AM UTC",cruces en zonas de riesgo juan pablo ii cristina larralde inundación media las puentes cristina larralde inundación media,2,3,0,0,https://twitter.com/GobSanNicolas/status/1803980632915071025#m,,,,inundación
@GobSanNicolas,Gobierno de San Nicolás,"Jun 21, 2024 · 2:38 AM UTC",juan pablo ii cristina larralde y san nicolás inundación media av manuel l barragán desde sendero hasta fidel vzz inundación media av lópez mateos en sus cruces con privada lópez mateos y fundidores inundación media,3,3,0,0,https://twitter.com/GobSanNicolas/status/1803980707024273897#m,,,,inundación
@GobSanNicolas,Gobierno de San Nicolás,"Jun 21, 2024 · 2:38 AM UTC",av universidad tapia a la altura de estación del metro tapia inundación media arroyo la talaverana a la altura de la col blas chumacera y talaverana inundación media,2,3,0,0,https://twitter.com/GobSanNicolas/status/1803980752251420706#m,,,,inundación
@GobSanNicolas,Gobierno de San Nicolás,"Jun 20, 2024 · 10:17 PM UTC",intensidad de lluvia por región zona poniente moderadaconstante zona centro moderadaconstante zona oriente moderadaconstante,0,2,0,0,https://twitter.com/GobSanNicolas/status/1803915073859011044#m,,,,lluvia
@GobSanNicolas,Gobierno de San Nicolás,"Jun 20, 2024 · 10:19 PM UTC",av lópez mateos en sus cruces con privada lópez mateos y fundidores inundación alta av universidad tapia a la altura de estación del metro tapia inundación alta arroyo la talaverana a la altura de la col blas chumacera y talaverana inundación media,1,2,0,0,https://twitter.com/GobSanNicolas/status/1803915557483221462#m,,,,inundación
@GobSanNicolas,Gobierno de San Nicolás,"Jun 20, 2024 · 10:18 PM UTC",cruces en zonas de riesgo juan pablo ii cristina larralde inundación media las puentes cristina larralde inundación baja juan pablo ii cristina larralde y san nicolás inundación baja av manuel l barragán desde sendero hasta fidel vzz inundación media,4,2,1,0,https://twitter.com/GobSanNicolas/status/1803915439635878339#m,,,,inundación
@DarkKnightMty,DarkKnightMty,"Jun 20, 2024 · 8:49 PM UTC",vasconcelos cerrado por inundación frente a plaza tanarah sí ahí donde a pesar de hacer una reparación pluvial nomás no se puede con ese constante problema cada que llueve monterrey spgg alberto,470,69,8,0,https://twitter.com/DarkKnightMty/status/1803893063758074073#m,,['https://video.twimg.com/ext_tw_video/1803893046532067328/pu/pl/TCUnPDgEQ2jOJ2PX.m3u8?tag=12'],,inundación
@elnortelocal,elnortelocal,"Jun 20, 2024 · 7:05 PM UTC",local ayd pide a la población no beber agua de la llave ya que por las recientes lluvias los procesos de purificación no alcanzan a aclararla,843,213,55,21,https://twitter.com/elnortelocal/status/1803866682655424820#m,,['https://video.twimg.com/ext_tw_video/1803866604289056769/pu/pl/AK4Kkhb2EQ-3jJut.m3u8?tag=12'],,lluvia
@samuel_garcias,Samuel García,"Jun 20, 2024 · 8:41 PM UTC",ya abrimos la compuerta de la boca para comenzar con el almacenamiento controlado toda el agua directa a el cuchillo y las lluvias siguen sigamos con mucha precaución y sin arriesgarnos,2311,232,151,15,https://twitter.com/samuel_garcias/status/1803890890705887532#m,,['https://video.twimg.com/amplify_video/1803890776650453001/pl/QP7X9hDjlGD46-2O.m3u8?tag=16'],,lluvia
@GobSanNicolas,Gobierno de San Nicolás,"Jun 20, 2024 · 8:43 PM UTC",intensidad de lluvia por región zona poniente bajaconstante zona centro moderadaconstante zona oriente moderadaconstante,3,3,0,0,https://twitter.com/GobSanNicolas/status/1803891490109976821#m,,,,lluvia
@daniel_carrillo,Daniel Carrillo Mtz,"Jun 21, 2024 · 1:46 AM UTC",arrecia nuevamente la lluvia en sannicolas arroyos debajo del de capacidad todas alas avenidas abiertas maneje con precaución pm gobsannicolas emergencias alerta,72,21,4,0,https://twitter.com/daniel_carrillo/status/1803967703901782403#m,,,,lluvia
@SoyDeSanNicolas,SAN NICOLÁS NEWS,"Jun 21, 2024 · 2:16 AM UTC",sin tregua otra vez la lluvia en sannicolas son remanentes pero con mucha intensidad,14,3,0,0,https://twitter.com/SoyDeSanNicolas/status/1803975362411409507#m,,,,lluvia
@SoyDeSanNicolas,SAN NICOLÁS NEWS,"Jun 20, 2024 · 11:59 PM UTC",regresa la lluvia en sannicolas se espera que dure el resto de la tarde,19,1,0,0,https://twitter.com/SoyDeSanNicolas/status/1803940792983036017#m,,,,lluvia
@LCAlatorre,Dr. Luis Carlos Alatorre,"Jun 20, 2024 · 9:39 PM UTC",niveles de las presas en nuevoleón de junio de a las hrs presa la boca namo lluvias almacenamiento mm presa cerro prieto almacenamiento mm presa el cuchillo almacenamiento mm,1787,231,85,19,https://twitter.com/LCAlatorre/status/1803905509847671128#m,['https://pbs.twimg.com/media/GQjCf8FXIAAzruy.jpg'],,,lluvia
@GobSanNicolas,Gobierno de San Nicolás,"Jun 20, 2024 · 7:24 PM UTC",cruces en zonas de riesgo juan pablo ii cristina larralde inundación media las puentes cristina larralde inundación baja juan pablo ii cristina larralde y san nicolás inundación media av manuel l barragán desde sendero hasta fidel vzz inundación media,10,9,1,0,https://twitter.com/GobSanNicolas/status/1803871532743082285#m,,,,inundación
@SoyDeSanNicolas,SAN NICOLÁS NEWS,"Jun 20, 2024 · 7:24 PM UTC",pm regresa la lluvia con mas intensidad a sannicolas aumentan los niveles de la banqueta en la zona las puentes,16,1,1,0,https://twitter.com/SoyDeSanNicolas/status/1803871551567097954#m,,,,lluvia
@nelvaldez,Nelson Valdez,"Jun 20, 2024 · 4:13 PM UTC",el monstruo convectivo que se aproxima a la zona metropolitana de monterrey intensa lluvia cerca del mediodía y extendiéndose por varias horas precaución alberto,2443,430,56,40,https://twitter.com/nelvaldez/status/1803823488614232558#m,['https://pbs.twimg.com/media/GQh33yXbQAAkQ_L.jpg'],,,lluvia
@samuel_garcias,Samuel García,"Jun 20, 2024 · 4:40 PM UTC",todos en alerta y en resguardo ni labores ni clases viene lluvia extrema,5037,421,194,47,https://twitter.com/samuel_garcias/status/1803830274599366965#m,['https://pbs.twimg.com/media/GQh-ExwWsAAGboG.jpg'],,,lluvia
@SoyDeSanNicolas,SAN NICOLÁS NEWS,"Jun 20, 2024 · 3:45 PM UTC",no hay cierres a las am en sannicolas circulen con precaucion porque regreso la lluvia,5,1,0,0,https://twitter.com/SoyDeSanNicolas/status/1803816416258220162#m,,,,lluvia
@SoyDeSanNicolas,SAN NICOLÁS NEWS,"Jun 20, 2024 · 3:40 PM UTC",am regresa la lluvia a sannicolas,5,1,0,0,https://twitter.com/SoyDeSanNicolas/status/1803815262413533184#m,,,,lluvia
@nelvaldez,Nelson Valdez,"Jun 20, 2024 · 2:57 PM UTC",alberto se degrada a una depresión tropical sus efectos de intensas lluvias continúan en las próximas horas en toda la región am,552,38,7,3,https://twitter.com/nelvaldez/status/1803804458318704685#m,,,,lluvia
@SoyDeSanNicolas,SAN NICOLÁS NEWS,"Jun 20, 2024 · 12:52 PM UTC",am tormenta alberto en sannicolas regresa la lluvia con mayor intensidad en el municipio siguen los encharcamientos en las principales avenidas,6,0,0,0,https://twitter.com/SoyDeSanNicolas/status/1803772943496777796#m,,,,lluvia
@daniel_carrillo,Daniel Carrillo Mtz,"Jun 20, 2024 · 12:40 PM UTC",precaución seguirá lluvias en san nicolás toma tu tiempo para tus actividades y prevención al manejar todas las avenidas sannicolás abiertas algunos carriles de baja velocidad presentan encharcamiento buen jueves cicmty cindycavazosmx marcosgarciardz lilyolivaresc,105,25,7,1,https://twitter.com/daniel_carrillo/status/1803769840437530970#m,,,,lluvia
@samuel_garcias,Samuel García,"Jun 20, 2024 · 5:16 AM UTC",gracias al trabajo de agua y drenaje nuestras presas están listas para captar toda el agua de estas lluvias y muy pronto estará llegando a nuestras casas sigamos prevenidos si no es necesario no salgan de casa y estén pendientes de los canales oficiales buenas noches,497,51,65,4,https://twitter.com/samuel_garcias/status/1803658056120643585#m,,['https://video.twimg.com/amplify_video/1803657186049974272/vid/avc1/1920x1080/lOPda0wyPVuEIf7Y.mp4?tag=16'],,lluvia
@SoyDeSanNicolas,SAN NICOLÁS NEWS,"Jun 20, 2024 · 3:51 AM UTC",arrecia la lluvia en la zona santo domingo sannicolas,12,1,1,0,https://twitter.com/SoyDeSanNicolas/status/1803636781130096739#m,,,,lluvia
@MilenioMty,Milenio Monterrey,"Jun 20, 2024 · 2:50 AM UTC",alertaporlluvias así se ve la corriente del río santa catarina tras el primer día de lluvias por la tormenta tropical alberto jorge lópez,716,69,1,4,https://twitter.com/MilenioMty/status/1803621421056401686#m,['https://pbs.twimg.com/media/GQe_mJbaQAA_4pU.jpg'],,,inundación
