Usuario,Nombre,Fecha,Texto,Likes,Retweets,Comentarios,Citas,Enlace,Imágenes,Videos,GIFs,Tipo
@911SanPedro,Rescate 911 San Pedro,"Jun 16, 2024 · 12:12 AM UTC",nos encontramos atendiendo junto a bomberosnl el reporte de un accidente e incendio de una motocicleta sobre la av lázaro cárdenas y av gómez morin spgg pcsp,17,5,0,0,https://twitter.com/911SanPedro/status/1802132007926841672#m,['https://pbs.twimg.com/media/GQJ1gvjW0AA_38z.jpg'],,,eléctrico
@911SanPedro,Rescate 911 San Pedro,"Jun 15, 2024 · 8:08 PM UTC",precaución sobre calzada del valle pteote y río támesis unidades atienden el reporte de un accidente vial con personas lesionadas spgg pcsp,10,2,0,1,https://twitter.com/911SanPedro/status/1802070647448744191#m,['https://pbs.twimg.com/media/GQI9tEpWYAApDqL.jpg'],,,no se relaciona
@911SanPedro,Rescate 911 San Pedro,"Jun 13, 2024 · 6:55 PM UTC",precaución sobre la av valle de san ángel y calle janitzio unidades atienden el reporte de accidente vial tipo volcadura de un camión de volteo unidades trabajando en el lugar vialidad cerrada en ambos sentidos spgg pcsp,11,3,0,1,https://twitter.com/911SanPedro/status/1801327615992799403#m,"['https://pbs.twimg.com/media/GP-Z41WXoAAUWRX.jpg', 'https://pbs.twimg.com/media/GP-Z43mW0AApgS9.jpg']",,,no se relaciona
@911SanPedro,Rescate 911 San Pedro,"Jun 10, 2024 · 7:01 PM UTC",aviso informativo a corto plazo el sistema meteorológico nacional pronostica lluvias con chubascos y fuertes rachas de viento de a kmh en las próximas horas a hrs es importante estar al pendiente de las redes y fuentes oficiales spgg pcsp,23,9,0,0,https://twitter.com/911SanPedro/status/1800241921400709233#m,['https://pbs.twimg.com/media/GPu-e4uXcAEaqrC.jpg'],,,lluvia
@911SanPedro,Rescate 911 San Pedro,"Jun 10, 2024 · 3:26 AM UTC",nos encontramos atendiendo el reporte de un incendio en poste y cables de media tensión en corto circuito sobre la calle onix y amatista spgg cpsp,22,5,3,2,https://twitter.com/911SanPedro/status/1800006714835763413#m,,['https://video.twimg.com/ext_tw_video/1800006695604924416/pu/vid/avc1/480x848/NVyIZGDl9Lo-XFLV.mp4?tag=12'],,eléctrico
@911SanPedro,Rescate 911 San Pedro,"Jun 8, 2024 · 8:15 PM UTC",precaución sobre la av morones prieto otepte y av josé vasconcelos unidades atienden el reporte de un accidente vial con personas lesionadas spgg pcsp,12,3,0,0,https://twitter.com/911SanPedro/status/1799535810061938804#m,,,,no se relaciona
@911SanPedro,Rescate 911 San Pedro,"Jun 7, 2024 · 6:22 PM UTC",aviso informativo a corto plazo el sistema meteorológico nacional pronostica lluvias con chubascos y fuertes rachas de viento en las próximas horas a hrs es importante estar al pendiente de las redes y fuentes oficiales spgg pcsp,32,10,1,0,https://twitter.com/911SanPedro/status/1799144973779996732#m,['https://pbs.twimg.com/media/GPfY0d2WMAAJOU7.jpg'],,,lluvia
@911SanPedro,Rescate 911 San Pedro,"Jun 7, 2024 · 3:26 AM UTC",actualmente tenemos fuertes ráfagas de viento y lluvia intensa en el municipio y área metropolitana se recomienda tomar precauciones al salir de casa y al conducir estamos atentos a sus reportes c san pedro c nuevo león spgg pcsp,26,5,0,1,https://twitter.com/911SanPedro/status/1798919547183079796#m,,['https://video.twimg.com/ext_tw_video/1798919488085299201/pu/vid/avc1/480x848/EpS8rnoFBrthk-HA.mp4?tag=12'],,lluvia
@911SanPedro,Rescate 911 San Pedro,"Jun 7, 2024 · 12:21 AM UTC",nos encontramos atendiendo junto a bomberosnl el reporte de un incendio en lote baldío sobre la av roberto garza sada otepte y calle ing francisco beltrán spgg pcsp,22,5,0,0,https://twitter.com/911SanPedro/status/1798872828361457948#m,['https://pbs.twimg.com/media/GPbhTPfacAAwrMT.jpg'],,,eléctrico
@911SanPedro,Rescate 911 San Pedro,"Jun 6, 2024 · 1:36 AM UTC",tenemos lluvia moderada en distintas zonas del municipio al manejar recuerda respetar el límite de velocidad utilizar el cinturón de seguridad encender las luces principales guardar mayor distancia entre vehículos emergencias san pedro spgg pcsp,7,3,0,1,https://twitter.com/911SanPedro/status/1798529431780131281#m,,,,lluvia
@911SanPedro,Rescate 911 San Pedro,"Jun 5, 2024 · 4:30 PM UTC",nos encontramos atendiendo junto a bomberosnl el reporte de un incendio de vehículo sobre manuel j clouthier y alejandro vi spgg pcsp,5,1,0,0,https://twitter.com/911SanPedro/status/1798391887671484784#m,,,,eléctrico
@911SanPedro,Rescate 911 San Pedro,"Jun 3, 2024 · 1:25 PM UTC",precaución sobre la av lázaro cárdenas pteote y paseo olga unidades atienden el reporte de un accidente vial tipo volcadura tráfico presente en la zona spgg pcsp,12,4,0,0,https://twitter.com/911SanPedro/status/1797620503013929317#m,['https://pbs.twimg.com/media/GPJuUhhXUAA6sqb.jpg'],,,no se relaciona
@911SanPedro,Rescate 911 San Pedro,"Jun 2, 2024 · 6:20 PM UTC",precaución sobre la av gómez morin y río pánuco unidades atienden el reporte de un accidente vial con personas lesionadas tráfico presente en la zona spgg pcsp,10,3,1,0,https://twitter.com/911SanPedro/status/1797332353527828852#m,,,,no se relaciona
@911SanPedro,Rescate 911 San Pedro,"May 29, 2024 · 5:14 AM UTC",nos encontramos en alerta por lluvias intensas se están presentando en el municipio hay que extremar precauciones al salir y reportar cualquier situación de emergencia a los teléfonos c san pedro c nl spgg pcsp,24,9,0,1,https://twitter.com/911SanPedro/status/1795685026597859508#m,,,,lluvia
@911SanPedro,Rescate 911 San Pedro,"May 28, 2024 · 10:41 PM UTC",precaución sobre la av josé vasconcelos otepte y río bravo unidades atienden el reporte de un accidente vial spgg pcsp,5,1,0,0,https://twitter.com/911SanPedro/status/1795586123949109507#m,['https://pbs.twimg.com/media/GOs0EFqW4AAnUmR.jpg'],,,no se relaciona
@911SanPedro,Rescate 911 San Pedro,"May 28, 2024 · 9:14 PM UTC",nos encontramos atendiendo junto a bomberosnl pcmty y pcnuevoleon el reporte de un incendio de maleza sobre ambos sentidos del blvd rogelio cantú y anillo periférico en monterrey mty pcsp,20,6,0,0,https://twitter.com/911SanPedro/status/1795564255204241836#m,"['https://pbs.twimg.com/media/GOsgLIyXoAAzx3Q.jpg', 'https://pbs.twimg.com/media/GOsgLJGWUAA6lJW.jpg']",,,eléctrico
@911SanPedro,Rescate 911 San Pedro,"May 25, 2024 · 4:25 AM UTC",precaución sobre calzada del valle otepte y río tamazunchale unidades brindan atención a una persona lesionada por accidente vial spgg pcsp,11,3,0,1,https://twitter.com/911SanPedro/status/1794223304397783268#m,['https://pbs.twimg.com/media/GOZcllfWgAA7mcJ.jpg'],,,no se relaciona
@911SanPedro,Rescate 911 San Pedro,"May 21, 2024 · 9:21 PM UTC",precaución sobre la av josé vasconcelos pteote y juan i ramón unidades atienden el reporte de un accidente vial con personas lesionadas spgg pcsp,6,2,0,1,https://twitter.com/911SanPedro/status/1793029267002958024#m,['https://pbs.twimg.com/media/GOIelGaXkAAXyQb.jpg'],,,no se relaciona
@911SanPedro,Rescate 911 San Pedro,"May 11, 2024 · 5:56 PM UTC",cierre de vialidad debido al fuerte accidente vial se realiza cierre de la av gómez morin norte a sur y general treviño spgg pcsp,19,12,0,2,https://twitter.com/911SanPedro/status/1789353873628397641#m,,,,no se relaciona
@911SanPedro,Rescate 911 San Pedro,"May 11, 2024 · 5:54 PM UTC",precaución sobre la av gomez morin y av roberto garza sada unidades atienden el reporte de un accidente vial en el cual participan varios vehículos spgg pcsp,33,5,0,1,https://twitter.com/911SanPedro/status/1789353279605866960#m,,['https://video.twimg.com/ext_tw_video/1789353255014653952/pu/vid/avc1/576x1280/OU3zrDhN5JbtwRKZ.mp4?tag=12'],,no se relaciona
@911SanPedro,Rescate 911 San Pedro,"May 10, 2024 · 7:55 PM UTC",precaución sobre la calle río sena y av humberto lobo unidades atienden el reporte de un accidente vial con personas lesionadas spgg pcsp,7,0,0,0,https://twitter.com/911SanPedro/status/1789021563116830994#m,['https://pbs.twimg.com/media/GNPhoRPbcAApgo1.jpg'],,,no se relaciona
@911SanPedro,Rescate 911 San Pedro,"May 10, 2024 · 3:37 AM UTC",nos encontramos atendiendo el reporte de un incendio en cableado sobre la calle río navia y rio bravo spgg pcsp,16,5,0,0,https://twitter.com/911SanPedro/status/1788775458164629867#m,,['https://video.twimg.com/ext_tw_video/1788775444340158465/pu/vid/avc1/480x848/2KHvewVx_LWSy2dw.mp4?tag=12'],,eléctrico
@conagua_clima,CONAGUA Clima,"Jun 21, 2024 · 1:13 AM UTC",se pronostican lluvias torrenciales para coahuila nuevoleón oaxaca puebla sanluispotosí tamaulipas y veracruz más información en,657,110,5,6,https://twitter.com/conagua_clima/status/1803959300999848028#m,['https://pbs.twimg.com/media/GQjza3sakAAXaTi.png'],,,lluvia
@conagua_clima,CONAGUA Clima,"Jun 20, 2024 · 9:56 AM UTC",se pronostican lluvias muy fuertes a intensas descargaseléctricas y rachas de viento de a kmh en regiones del noreste de méxico y veracruz así como oleaje elevado y posibles trombas marinas en su zona costera más información en,114,24,3,1,https://twitter.com/conagua_clima/status/1803728517122957405#m,"['https://pbs.twimg.com/media/GQghCuFasAAFkJh.jpg', 'https://pbs.twimg.com/media/GQghG_jawAAjaWT.jpg']",,,lluvia
@lopezdoriga,Joaquín López-Dóriga,"Jun 20, 2024 · 12:15 AM UTC",así el río santa catarina en monterrey en medio de las lluvias provocadas por alberto autoridades recorren la ciudad ante posibles afectaciones video vía protección civil monterrey pcmty,1225,168,54,8,https://twitter.com/lopezdoriga/status/1803582322752573474#m,,['https://video.twimg.com/ext_tw_video/1803582298639462400/pu/pl/xdDnS30-i9XJ-0K1.m3u8?tag=12'],,lluvia
@SkyAlertStorm,SkyAlert Storm,"Jun 19, 2024 · 11:27 PM UTC",río santa catarina monterrey se reportan fuertes lluvias en la capital de nuevoleón debido a las bandas nubosas del ciclóntropical alberto se espera que se intensifiquen en las próximas horas generando riesgo de inundaciones urbanas toma precauciones pcmty,1190,250,18,10,https://twitter.com/SkyAlertStorm/status/1803570237305974916#m,,['https://video.twimg.com/ext_tw_video/1803568737875886081/pu/pl/H5DG1uoJClZZlW_e.m3u8?tag=12'],,inundación
@pc_mty,Protección Civil Monterrey,"Jun 19, 2024 · 11:14 PM UTC",nos encontramos atendiendo un accidente vial en ruiz cortines y conchello en donde se atiende a conductor de motocicleta,70,8,1,2,https://twitter.com/pc_mty/status/1803567093670936668#m,,['https://video.twimg.com/ext_tw_video/1803566992735002625/pu/pl/_FH_GmucRZVRyhzn.m3u8?tag=12'],,no se relaciona
@pc_mty,Protección Civil Monterrey,"Jun 19, 2024 · 11:09 PM UTC",continuamos con los recorridos ante las lluvias en la ciudad si estás en una emergencia llama al,361,60,5,5,https://twitter.com/pc_mty/status/1803565823400849889#m,,['https://video.twimg.com/ext_tw_video/1803565082296692739/pu/pl/GlQAwdjBsjJrmLWJ.m3u8?tag=12'],,lluvia
@conagua_clima,CONAGUA Clima,"Jun 19, 2024 · 7:41 PM UTC",en las próximas horas se esperan lluvias de fuertes a torrenciales en coahuila nuevoleón tamaulipas sanluispotosí zacatecas hidalgo puebla y veracruz de fuertes a intensas en oaxaca chiapas tabasco campeche y quintanaroo,645,115,10,3,https://twitter.com/conagua_clima/status/1803513436174950532#m,['https://pbs.twimg.com/media/GQddTq4aIAMTbP_.jpg'],,,lluvia
@pc_mty,Protección Civil Monterrey,"Jun 18, 2024 · 8:57 PM UTC",los semáforos pluviales se encuentran en puntos estratégicos de la ciudad con la finalidas de que todas y todos tengamos las precauciones necesarias en las zonas con riesgo de inundación o encharcamientos comparte esta información con todos y todas,15,8,1,0,https://twitter.com/pc_mty/status/1803170075613999473#m,['https://pbs.twimg.com/media/GQYloIzXQAAEAYJ.jpg'],,,inundación
@conagua_clima,CONAGUA Clima,"Jun 18, 2024 · 3:42 PM UTC",durante las siguientes horas se esperan lluvias y chubascos con posibles descargaseléctricas así como rachas de viento y trombas marinas en regiones de los estados del noreste de méxico checa los detalles aquí,37,9,0,1,https://twitter.com/conagua_clima/status/1803090951071830464#m,['https://pbs.twimg.com/media/GQXdQHQakAE0qE9.jpg'],,,lluvia
@pc_mty,Protección Civil Monterrey,"Jun 18, 2024 · 3:54 PM UTC",atendemos reporte de accidente vial en la carretera nacional con dirección al sur antes del uro la rioja,4,0,0,0,https://twitter.com/pc_mty/status/1803093945930400022#m,['https://pbs.twimg.com/media/GQXgYl3b0AAWLcM.jpg'],,,no se relaciona
@pc_mty,Protección Civil Monterrey,"Jun 18, 2024 · 3:53 PM UTC",atendemos reporte de accidente vial en la carretera nacional con dirección al sur antes del uro la rioja,9,2,0,0,https://twitter.com/pc_mty/status/1803093682842656856#m,['https://pbs.twimg.com/media/GQXgJVsbMAAnX15.jpg'],,,no se relaciona
@pc_mty,Protección Civil Monterrey,"Jun 18, 2024 · 2:12 PM UTC",buenos días durante esta mañana estamos atendiendo un accidente vial en la calle capitan aguilar en la colonia deportivo obispado,12,0,0,0,https://twitter.com/pc_mty/status/1803068368389288142#m,['https://pbs.twimg.com/media/GQXJH3DXsAA_rpx.jpg'],,,no se relaciona
@conagua_clima,CONAGUA Clima,"Jun 18, 2024 · 12:18 PM UTC",el potencialciclóntropical uno se localiza km al oeste de celestún yucatán y a km al estesureste de la pesca tamaulipas producirá lluvias puntuales intensas en el noreste oriente y sureste de méxico además de la penínsuladeyucatán más información,526,149,0,7,https://twitter.com/conagua_clima/status/1803039531798806665#m,['https://pbs.twimg.com/media/GQWu5DbagAAlvj4.jpg'],,,lluvia
@pc_mty,Protección Civil Monterrey,"Jun 18, 2024 · 2:11 PM UTC",durante la madrugada atendimos un accidente vial en la avenida constitución en la que participó un camión de carga en el lugar se trabajó derrames y se valoró a las personas implicadas en el accidente,19,2,1,0,https://twitter.com/pc_mty/status/1803068034287829218#m,,['https://video.twimg.com/ext_tw_video/1803068013966401536/pu/pl/Oks5OPznXGJxcw96.m3u8?tag=12'],,no se relaciona
@pc_mty,Protección Civil Monterrey,"Jun 18, 2024 · 12:07 AM UTC",atendemos reporte de accidente vial en avenida venustiano carranza en la colonia loma larga en el que está involucrado un camión de ruta urbana en el lugar se valoran a las personas involucradas en el accidente,10,3,0,0,https://twitter.com/pc_mty/status/1802855598410649667#m,,['https://video.twimg.com/ext_tw_video/1802855582803578882/pu/pl/t12E9Ya6Fgb3ZkXM.m3u8?tag=12'],,inundación
@conagua_clima,CONAGUA Clima,"Jun 17, 2024 · 9:42 PM UTC",esta tarde se formó el potencialciclóntropical uno al sur del golfodeméxico frente a las costas de campeche y tabasco ocasionará durante las próximas horas lluvias intensas a torrenciales y vientos fuertes en el sureste de méxico y la penínsuladeyucatán más,673,218,5,13,https://twitter.com/conagua_clima/status/1802819083450401222#m,['https://pbs.twimg.com/media/GQTmU4faEAA59_t.jpg'],,,lluvia
@pc_mty,Protección Civil Monterrey,"Jun 17, 2024 · 8:23 PM UTC",ante cualquier emergencia que pueda surgir durante las lluvias que se aproximan te proporcionamos los números de emergencia,42,25,0,2,https://twitter.com/pc_mty/status/1802799358984769739#m,['https://pbs.twimg.com/media/GQTUdlhXkAAJ2kU.jpg'],,,lluvia
@pc_mty,Protección Civil Monterrey,"Jun 17, 2024 · 8:21 PM UTC",atendemos reporte de incendio en negocio en canal aztlán y de la comunicación en la colonia barrio de la industria en el lugar se trabaja en coordinación con bomberos de nuevo león para la sofocación y eliminación de riesgos,6,0,0,0,https://twitter.com/pc_mty/status/1802798774072316175#m,['https://pbs.twimg.com/media/GQTT7ekXEAA4FbD.jpg'],,,eléctrico
@pc_mty,Protección Civil Monterrey,"Jun 17, 2024 · 7:39 PM UTC",para los próximos días se exhorta tomar las precauciones necesarias por la presencia de lluvias muy fuertes a intensas así como mantenerse informados a través de nuestros avisos meteorológicos y estar atentos a las indicaciones de protección civil,49,16,0,0,https://twitter.com/pc_mty/status/1802788173048603117#m,"['https://pbs.twimg.com/media/GQTKSZvWMAA7EUG.jpg', 'https://pbs.twimg.com/media/GQTKSZuXYAEJcnf.jpg', 'https://pbs.twimg.com/media/GQTKSZtXEAAQFVz.jpg']",,,lluvia
@pc_mty,Protección Civil Monterrey,"Jun 17, 2024 · 7:32 PM UTC",en este momento nos encontramos atendiendo incendio de vehículo en paseo de los leones y cumbres del sol en el lugar no se reportan lesionados,13,2,0,0,https://twitter.com/pc_mty/status/1802786500699975772#m,['https://pbs.twimg.com/media/GQTIw90WAAA9IlA.jpg'],,,eléctrico
@pc_mty,Protección Civil Monterrey,"Jun 17, 2024 · 1:17 PM UTC",nos encontramos atendiendo un accidente vial en la av paseo de los leones y la av sevilla colonia bosques de las cumbres se está trabajando en coordinación con movilidad de monterrey y auxilio vial,31,8,0,1,https://twitter.com/pc_mty/status/1802692127622643817#m,,['https://video.twimg.com/ext_tw_video/1802692112267284480/pu/pl/QBqkIWefDNLAIxh9.m3u8?tag=12'],,no se relaciona
@rayelizalder,Ray Elizalde,"May 30, 2024 · 11:47 PM UTC",actualización afortunadamente descartan muertes controla protección civil de nuevo león y bomberos de diversas corporaciones incendio en autopista a saltillo señalan hay dos heridos y al momento no reportan fallecidos tras el reporte de un evento carretero donde las,42,10,4,1,https://twitter.com/rayelizalder/status/1796327721582080325#m,,['https://video.twimg.com/amplify_video/1796327650408992768/pl/rWB1hc7Itsv5vzcq.m3u8?tag=14'],,eléctrico
@Angel_MedellinN,Angel Medellín Reportero,"Jun 20, 2024 · 7:11 PM UTC",ciudadano graba inundación en la avenida vía tampico y constituyentes de nuevo león arualsanpedrogg juliocesarcano pcnuevoleon rayelizalder tormentaalberto tormentatropicalalberto,33,8,0,1,https://twitter.com/Angel_MedellinN/status/1803868262603853988#m,,['https://video.twimg.com/ext_tw_video/1803868208887402498/pu/pl/UOaIDPeqiGhK3fa7.m3u8?tag=12'],,inundación
@Angel_MedellinN,Angel Medellín Reportero,"Jun 19, 2024 · 3:34 AM UTC",continúa la movilización en avenida chocolate y libramiento tras accidente de trailer con el tren escobedo accidente nmasmonterrey arualsanpedrogg rayelizalder,5,4,0,0,https://twitter.com/Angel_MedellinN/status/1803270004143485281#m,['https://pbs.twimg.com/media/GQaAgzpXUAAU5oq.jpg'],,,no se relaciona
@joluisgarcia,José Luis García C,"Jun 18, 2024 · 1:40 AM UTC",leo muchas opiniones divididas con el tema de suspensión de clases por lluvias en nl ustedes qué piensan,23,9,51,4,https://twitter.com/joluisgarcia/status/1802879044762861572#m,,,,lluvia
@Informativo3651,Informativo365,"Jun 20, 2024 · 10:11 PM UTC",fonda lascomadre fue arrastrada por la corriente del río ramos en allendenl se informó que días antes de las lluvias sacaron los utensilios y herramientas del lugar acuérdense que los daños materiales son reemplazables no se arriesguen por andar de curiosos,27,11,1,0,https://twitter.com/Informativo3651/status/1803913663067152422#m,['https://pbs.twimg.com/media/GQjJ0PUW8AAcLxx.jpg'],,,inundación
@Informativo3651,Informativo365,"Jun 20, 2024 · 3:50 AM UTC",ultimahora se suspende en nl el servicio del metro y transmetro a partir de las del jueves hasta horas del mismo día por condiciones meteorológicas tormentatropical alberto lluvia,6,4,0,0,https://twitter.com/Informativo3651/status/1803636589735686484#m,['https://pbs.twimg.com/media/GQfN67aX0AAK4sZ.jpg'],,,lluvia
@Informativo3651,Informativo365,"Jun 18, 2024 · 4:02 PM UTC",infórmate nuevoleon informa que se extiende la suspensión de clases ante las fuertes lluvias que se esperan para la entidad la disposición aplica a partir de este miércoles de junio en el turno matutino la salida será a las del día,2,2,1,0,https://twitter.com/Informativo3651/status/1803095987826692434#m,['https://pbs.twimg.com/media/GQXiPuFXoAAK1sV.jpg'],,,lluvia
@Informativo3651,Informativo365,"Jun 18, 2024 · 12:39 AM UTC",ante el pronóstico de lluvias intensas por la llegada del primer potencial ciclónico de la temporada el gobierno de nl llamó a la población a entrar en alerta máxima y anunció la suspensión de clases la tarde del miércoles y ambos turnos del jueves,3,1,1,0,https://twitter.com/Informativo3651/status/1802863589885125073#m,"['https://pbs.twimg.com/media/GQUO4Y0XYAEY7M6.jpg', 'https://pbs.twimg.com/media/GQUO4aCX0AAY_64.jpg']",,,lluvia
@Informativo3651,Informativo365,"May 27, 2024 · 12:46 AM UTC",infórmate tras calor infernal de en la zona metropolitana de monterrey cae lluvia y granizo,14,3,0,0,https://twitter.com/Informativo3651/status/1794892904445710785#m,,['https://video.twimg.com/ext_tw_video/1794892792549777408/pu/pl/eH7aMdJFVkurjn2c.m3u8?tag=12'],,lluvia
@Informativo3651,Informativo365,"Apr 17, 2024 · 9:44 PM UTC",precaucion se presenta lluvia y granizo en la zona sur de monterrey extreme precaución al conducir pavimento resbaladizo,15,1,2,0,https://twitter.com/Informativo3651/status/1780713888792920185#m,,['https://video.twimg.com/ext_tw_video/1780713785432682496/pu/pl/ipucS0d5WWSNZuY1.m3u8?tag=12'],,lluvia
@Informativo3651,Informativo365,"Apr 14, 2024 · 10:03 PM UTC",incendiovehicular incendio de camión urbano de la ruta sobre la avenida eloy cavazos a la altura de la colonia héctor caballero tráfico pesado en la zona,6,3,0,0,https://twitter.com/Informativo3651/status/1779631469209497967#m,"['https://pbs.twimg.com/media/GLKFU5RWMAA99_c.jpg', 'https://pbs.twimg.com/media/GLKFVEQWAAA7FpK.jpg']",,,eléctrico
@Informativo3651,Informativo365,"Apr 11, 2024 · 12:14 AM UTC",momento del colapso del puente peatonal ubicado sobre la avenida la aurora y zócalo en sannicolás el cual fue captado por una cámara de vigilancia aquí el momento,49,20,2,1,https://twitter.com/Informativo3651/status/1778214948243415512#m,,['https://video.twimg.com/ext_tw_video/1778214922662367232/pu/pl/D9BWj9OAH-F1A2Kk.m3u8?tag=12'],,no se relaciona
@Informativo3651,Informativo365,"Apr 10, 2024 · 11:43 PM UTC",colapsa puente en la avenida la aurora y zócalo en sannicolás el percance se registró luego de que una grúa con exceso de dimensiones intentara pasar por el sitio de manera preliminar se habla de tres lesionados y dos vehículos dañados,11,3,0,0,https://twitter.com/Informativo3651/status/1778207116358299977#m,"['https://pbs.twimg.com/media/GK118rsXQAAFeZL.jpg', 'https://pbs.twimg.com/media/GK118tmX0AAh-yw.jpg', 'https://pbs.twimg.com/media/GK118whXEAARgoc.jpg']",,,no se relaciona
@Informativo3651,Informativo365,"Mar 26, 2024 · 11:18 PM UTC",urgente en éstos momentos se registra incendio en la empresa coparmex ubicada en la av san nicolás movilidadsn arbsanjorge gobsannicolas,7,2,0,0,https://twitter.com/Informativo3651/status/1772765088694301175#m,,['https://video.twimg.com/ext_tw_video/1772765073984892928/pu/pl/wbI23F7CCOyWlzLE.m3u8?tag=12'],,eléctrico
@Informativo3651,Informativo365,"Mar 26, 2024 · 6:49 PM UTC",conductor de un tráiler muere en un aparatoso accidente vial tras impactarse con un vehículo particular en dr gonzález nl hasta el momento se desconoce la identidad del hombre,9,4,1,1,https://twitter.com/Informativo3651/status/1772697461598912547#m,"['https://pbs.twimg.com/media/GJni8aoWgAASxcI.jpg', 'https://pbs.twimg.com/media/GJni8bUXEAEyk7I.jpg']",,,no se relaciona
@nelvaldez,Nelson Valdez,"Jun 21, 2024 · 12:03 PM UTC",pronóstico del tiempo hoy la lluvia se mantiene intermitente por la mañana en ocasiones fuerte por la tarde la precipitación se vuelve más ocasional o en intervalos y máxima cercana a c climadel monterrey,485,37,7,2,https://twitter.com/nelvaldez/status/1804122860098851285#m,['https://pbs.twimg.com/media/GQmILa5akAAJlX6.png'],,,lluvia
@LCAlatorre,Dr. Luis Carlos Alatorre,"Jun 21, 2024 · 12:35 PM UTC",niveles de las presas en nuevoleón de junio de a las hrs presa la boca namo lluvias almacenamiento mm presa cerro prieto almacenamiento mm presa el cuchillo almacenamiento mm,1537,228,35,29,https://twitter.com/LCAlatorre/status/1804131100735717819#m,,,,lluvia
@ParqueChipinque,Parque Ecológico Chipinque A.B.P.,"Jun 20, 2024 · 7:55 PM UTC",las fuertes lluvias han impactado significativamente al parque ecológico chipinque les compartimos estas imágenes para puedan ver el estado actual de nuestra reserva natural durante estos eventos climáticos chipinque lluviastropicales tormentaalberto,861,180,8,4,https://twitter.com/ParqueChipinque/status/1803879473215082803#m,,['https://video.twimg.com/ext_tw_video/1803879324493185024/pu/pl/MQavV-t_C1ws8QYh.m3u8?tag=12'],,lluvia
@mtygob,Gobierno Monterrey,"Jun 21, 2024 · 2:51 AM UTC",cierres a la vialidad por inundaciones zona centro conchello y san nicolas ruiz cortines y conchello constitución carriles ordinarios y dr coss constitución carriles ordinarios y padre mier carriles express de las avenidas moroes prieto y constitución,12,2,2,0,https://twitter.com/mtygob/status/1803984061037449586#m,,,,inundación
@telediariomty,@telediariomty,"Jun 21, 2024 · 2:47 AM UTC",conduce con precaución protección civil reporta fuerte lluvia en carretera monterreyreynosa,8,1,0,0,https://twitter.com/telediariomty/status/1803983021487624485#m,,,,lluvia
@cesarmty,César Cepeda,"Jun 21, 2024 · 1:18 AM UTC",importante después de alberto en el golfo de méxico está en proceso de formación otro ciclón de probabilidad y que en caso de que se confirme se llamaría berly y se espera que traiga más lluvias a nuevo león en los próximos días,1642,322,49,70,https://twitter.com/cesarmty/status/1803960626458337550#m,['https://pbs.twimg.com/media/GQj0itAXgAASl0P.jpg'],,,lluvia
@nelvaldez,Nelson Valdez,"Jun 20, 2024 · 11:03 PM UTC",otra banda convectiva más se aproxima a la zona metropolitana de monterrey continúan la lluvia de manera intermitente durante la noche pm climadel alberto,1039,129,30,6,https://twitter.com/nelvaldez/status/1803926724000067608#m,['https://pbs.twimg.com/media/GQjVyu8asAAHW2O.jpg'],,,lluvia
